{"bootstrap":{"guard_artifact_sha256":"cb4b98cd1835cf3be5f92d25ad406fe504b43cc210a92201fd4eae8c6e61a70f","runtime_identity_format":"EVOGUARD_GUARD_ZIPAPP_SHA256_V1"},"context":{"candidate_sha256":"47f546f8566b5ab52476abae6f193c12ea2937f891e412d807be4659b155b908","format":"EVOGUARD_RELEASE_SOURCE_CONTEXT_V1","parent_commit_sha":"7e20173cd7df6c7fe08e1b5cd6e76c2048abd929","parent_tree_sha":"21c0b988ea31c2cae3ce59c2dfb94d0c3978e9d4","policy_sha256":"7a9e92aa27949c962066b089046892bda4bf26891ee1b3ac49b411a825dc61a9","protected_ref":"refs/heads/main","repository":"EvoRiseKsa/EvoOM-Guard-m","repository_id":"1293651176","run_attempt":1,"run_id":"30701872897","target_commit_sha":"6bb4c328e56661b661e50532886802c6ba36a997","target_tree_sha":"bd81a595ca8608ad7da04390f31d5e489f5083ef","verifier_pack_sha256":"c129b33d647767db647906684fbfcc2ba834592a28b74ce4f02009984623ef43"},"execution":{"candidate_isolation":"docker","guard_exit_code":0,"network":"none","outcome":"PASS","overall_profile":"black_box_external_judge","report_integrity":"external_process_isolated"},"format":"EVOGUARD_RELEASE_SOURCE_PRODUCER_RECEIPT_V1","handoff":{"sha256":"366324320d622ea04da250edeec103001f5cb7f5d29e4a83b48ad491d7f63944","size":1183},"producer":{"runner_class":"github-hosted","trigger_workflow_blob_sha":"e51a1aa4b32ea6f59acfe4969a7f70d89a90403a","trigger_workflow_id":"319948714","trigger_workflow_path":".github/workflows/evoguard-release-source-reverify.yml","trigger_workflow_run_attempt":1,"trigger_workflow_run_id":"30701872897","workflow_blob_sha":"46208e861ee0d532d1aad5031a4616139e925ebc","workflow_commit_sha":"6bb4c328e56661b661e50532886802c6ba36a997","workflow_event":"workflow_run","workflow_id":"319948712","workflow_path":".github/workflows/evoguard-produce-release-source-receipt.yml","workflow_ref":"refs/heads/main","workflow_repository":"EvoRiseKsa/EvoOM-Guard-m","workflow_repository_id":"1293651176","workflow_run_attempt":1,"workflow_run_id":"30701901542"},"record":{"sha256":"b69ae7d032606830b16ffc15b824eb3aed5cb8d382b3392b828109faec2a155e","size":9131},"source":{"default_branch":"main","protected_ref":"refs/heads/main","repository":"EvoRiseKsa/EvoOM-Guard-m","repository_id":"1293651176","target_commit_sha":"6bb4c328e56661b661e50532886802c6ba36a997","target_tree_sha":"bd81a595ca8608ad7da04390f31d5e489f5083ef","workflow_run_attempt":1,"workflow_run_id":"30701872897"}}
