{"bootstrap":{"guard_artifact_sha256":"cb4b98cd1835cf3be5f92d25ad406fe504b43cc210a92201fd4eae8c6e61a70f","runtime_identity_format":"EVOGUARD_GUARD_ZIPAPP_SHA256_V1"},"context":{"candidate_sha256":"bd1c51a955072b5190083559b32413abce345732194ae4e11d5752b6ba65a9c4","format":"EVOGUARD_RELEASE_SOURCE_CONTEXT_V1","parent_commit_sha":"efb14217171138aacd4597dface4ca8517b0aebb","parent_tree_sha":"ae5da3e76a99ba018e1cd0a68c8f5541b5178b04","policy_sha256":"7a9e92aa27949c962066b089046892bda4bf26891ee1b3ac49b411a825dc61a9","protected_ref":"refs/heads/main","repository":"EvoRiseKsa/EvoOM-Guard-m","repository_id":"1293651176","run_attempt":1,"run_id":"31714267881","target_commit_sha":"d65f25f386fe6f4646ea8dd3cbbe1d5d889f73d4","target_tree_sha":"71657b2bde83701c95b66b60f37be1580423ad32","verifier_pack_sha256":"c129b33d647767db647906684fbfcc2ba834592a28b74ce4f02009984623ef43"},"execution":{"candidate_isolation":"docker","guard_exit_code":0,"network":"none","outcome":"PASS","overall_profile":"black_box_external_judge","report_integrity":"external_process_isolated"},"format":"EVOGUARD_RELEASE_SOURCE_PRODUCER_RECEIPT_V1","handoff":{"sha256":"ddafc9c38bd9dedbab55de6457f84164304137f8c9be916517fa5fbd25044f45","size":1183},"producer":{"runner_class":"github-hosted","trigger_workflow_blob_sha":"fb6a30a4576c0cb51fa7d9cd759dafba1be59bbc","trigger_workflow_id":"319948714","trigger_workflow_path":".github/workflows/evoguard-release-source-reverify.yml","trigger_workflow_run_attempt":1,"trigger_workflow_run_id":"31714267881","workflow_blob_sha":"ae6c2ecda3e7b29223db69b33b9135949e0ad567","workflow_commit_sha":"d65f25f386fe6f4646ea8dd3cbbe1d5d889f73d4","workflow_event":"workflow_run","workflow_id":"319948712","workflow_path":".github/workflows/evoguard-produce-release-source-receipt.yml","workflow_ref":"refs/heads/main","workflow_repository":"EvoRiseKsa/EvoOM-Guard-m","workflow_repository_id":"1293651176","workflow_run_attempt":1,"workflow_run_id":"31714347958"},"record":{"sha256":"9de1179a271cd075186dde779aab1a5b5063f61a9e9f9214f2b3698d4ed11d96","size":9131},"source":{"default_branch":"main","protected_ref":"refs/heads/main","repository":"EvoRiseKsa/EvoOM-Guard-m","repository_id":"1293651176","target_commit_sha":"d65f25f386fe6f4646ea8dd3cbbe1d5d889f73d4","target_tree_sha":"71657b2bde83701c95b66b60f37be1580423ad32","workflow_run_attempt":1,"workflow_run_id":"31714267881"}}
