{"bootstrap":{"guard_artifact_sha256":"cb4b98cd1835cf3be5f92d25ad406fe504b43cc210a92201fd4eae8c6e61a70f","runtime_identity_format":"EVOGUARD_GUARD_ZIPAPP_SHA256_V1"},"context":{"candidate_sha256":"a2ed5f23902bcc31e4d1f07ec640df65b97a3417e05dab44eadeb55c83298da8","format":"EVOGUARD_RELEASE_SOURCE_CONTEXT_V1","parent_commit_sha":"6e03582f29cab6183709fb36b117fe3bbd0b3586","parent_tree_sha":"8030dcb8f3e2daf7af12271dd54b80b695d2d1ad","policy_sha256":"7a9e92aa27949c962066b089046892bda4bf26891ee1b3ac49b411a825dc61a9","protected_ref":"refs/heads/main","repository":"EvoRiseKsa/EvoOM-Guard-m","repository_id":"1293651176","run_attempt":1,"run_id":"30441835115","target_commit_sha":"699c60c22445a6af54c58f31fca34edc225b98a9","target_tree_sha":"d2da75aeb1da13111c081c41c22e24bf0f16f19c","verifier_pack_sha256":"c129b33d647767db647906684fbfcc2ba834592a28b74ce4f02009984623ef43"},"execution":{"candidate_isolation":"docker","guard_exit_code":0,"network":"none","outcome":"PASS","overall_profile":"black_box_external_judge","report_integrity":"external_process_isolated"},"format":"EVOGUARD_RELEASE_SOURCE_PRODUCER_RECEIPT_V1","handoff":{"sha256":"91335b1057eb527ec15912f7f05b011d7d582da2d4e5e8712ac7c4d865561cb7","size":1183},"producer":{"runner_class":"github-hosted","trigger_workflow_blob_sha":"42cfdd0ba1e5a3f29a7cc0047a54ce924e6540d3","trigger_workflow_id":"319948714","trigger_workflow_path":".github/workflows/evoguard-release-source-reverify.yml","trigger_workflow_run_attempt":1,"trigger_workflow_run_id":"30441835115","workflow_blob_sha":"46208e861ee0d532d1aad5031a4616139e925ebc","workflow_commit_sha":"699c60c22445a6af54c58f31fca34edc225b98a9","workflow_event":"workflow_run","workflow_id":"319948712","workflow_path":".github/workflows/evoguard-produce-release-source-receipt.yml","workflow_ref":"refs/heads/main","workflow_repository":"EvoRiseKsa/EvoOM-Guard-m","workflow_repository_id":"1293651176","workflow_run_attempt":1,"workflow_run_id":"30441893690"},"record":{"sha256":"6e29b0791e9543d850df4fa051aaf3b2da25c8d934e382ea050ed72297d3598f","size":9131},"source":{"default_branch":"main","protected_ref":"refs/heads/main","repository":"EvoRiseKsa/EvoOM-Guard-m","repository_id":"1293651176","target_commit_sha":"699c60c22445a6af54c58f31fca34edc225b98a9","target_tree_sha":"d2da75aeb1da13111c081c41c22e24bf0f16f19c","workflow_run_attempt":1,"workflow_run_id":"30441835115"}}
